<?xml version="1.0" encoding="UTF-8"?>
<!DOCTYPE config PUBLIC "/AIJIANGNANLOVEHOUJUANJUAN/" "code-generator.dtd">

<config>
    <settings>
        <setting name="enableSerializable" value="true"/>
    </settings>
    <dataSource
            driver="com.mysql.jdbc.Driver"
            url="jdbc:mysql://47.104.148.155:3306/codeartist"
            username="root"
            password="root"
    />
    <javaModelGenerator
            targetPackage="com.codeartist.mybatis.disc.model"
            targetProject="./src/main/java"
    />
    <mapperGenerator
            targetPackage="com.codeartist.mybatis.disc.mapper"
            targetProject="./src/main/java"
    />
    <javaDaoGenerator
            targetPackage="com.codeartist.mybatis.disc.mapper"
            targetProject="./src/main/java"
    />
    <interfaceGenerator
            targetPackage="com.codeartist.mybatis.disc.mapper"
            targetProject="./src/main/java"
    />
    <serviceGenerator
            targetPackage="com.codeartist.mybatis.disc.mapper"
            targetProject="./src/main/java"
    />
    <controllerGenerator
            targetPackage="com.codeartist.mybatis.disc.mapper"
            targetProject="./src/main/java"
    />
    <table className="Admin" tableName="admin"/>
    <table className="" tableName="role"/>
</config>